{
  "schema_version": "1.0.0",
  "feed_id": "jp_affiliates",
  "last_updated": "2026-10-18T22:02:56+09:00",
  "source": {
    "label": "経産省 海外事業活動基本調査（e-Stat・Excel参考表）",
    "url": "https://www.e-stat.go.jp/stat-search/files?toukei=00550120",
    "license": "政府統計の総合窓口（e-Stat）利用規約に準拠",
    "disclaimer_ja": "経産省『海外事業活動基本調査』（政府統計コード 00550120）は e-Stat 上 Excel/ファイル公開が主で、getStatsList(statsCode=00550120) は 0 件。本データは e-Stat 掲載の「（参考）国・地域別現地法人企業数（詳細版）」Excel を半自動コレクターで取込・正規化（第54回・2023年度実績）。"
  },
  "meta": {
    "countries": [
      {
        "iso2": "VN",
        "name_ja": "ベトナム",
        "name_en": "Vietnam"
      },
      {
        "iso2": "TH",
        "name_ja": "タイ",
        "name_en": "Thailand"
      },
      {
        "iso2": "CN",
        "name_ja": "中国",
        "name_en": "China"
      },
      {
        "iso2": "IN",
        "name_ja": "インド",
        "name_en": "India"
      },
      {
        "iso2": "ID",
        "name_ja": "インドネシア",
        "name_en": "Indonesia"
      },
      {
        "iso2": "PH",
        "name_ja": "フィリピン",
        "name_en": "Philippines"
      },
      {
        "iso2": "MY",
        "name_ja": "マレーシア",
        "name_en": "Malaysia"
      },
      {
        "iso2": "SG",
        "name_ja": "シンガポール",
        "name_en": "Singapore"
      },
      {
        "iso2": "KR",
        "name_ja": "韓国",
        "name_en": "Korea"
      },
      {
        "iso2": "HK",
        "name_ja": "香港",
        "name_en": "Hong Kong SAR"
      },
      {
        "iso2": "AE",
        "name_ja": "UAE",
        "name_en": "United Arab Emirates"
      },
      {
        "iso2": "SA",
        "name_ja": "サウジアラビア",
        "name_en": "Saudi Arabia"
      },
      {
        "iso2": "TR",
        "name_ja": "トルコ",
        "name_en": "Turkiye"
      },
      {
        "iso2": "GB",
        "name_ja": "英国",
        "name_en": "United Kingdom"
      },
      {
        "iso2": "DE",
        "name_ja": "ドイツ",
        "name_en": "Germany"
      },
      {
        "iso2": "FR",
        "name_ja": "フランス",
        "name_en": "France"
      },
      {
        "iso2": "US",
        "name_ja": "米国",
        "name_en": "United States"
      },
      {
        "iso2": "CA",
        "name_ja": "カナダ",
        "name_en": "Canada"
      },
      {
        "iso2": "BR",
        "name_ja": "ブラジル",
        "name_en": "Brazil"
      },
      {
        "iso2": "TW",
        "name_ja": "台湾",
        "name_en": "Taiwan"
      },
      {
        "iso2": "AU",
        "name_ja": "オーストラリア",
        "name_en": "Australia"
      },
      {
        "iso2": "MX",
        "name_ja": "メキシコ",
        "name_en": "Mexico"
      },
      {
        "iso2": "ES",
        "name_ja": "スペイン",
        "name_en": "Spain"
      },
      {
        "iso2": "IT",
        "name_ja": "イタリア",
        "name_en": "Italy"
      },
      {
        "iso2": "NL",
        "name_ja": "オランダ",
        "name_en": "Netherlands"
      },
      {
        "iso2": "PL",
        "name_ja": "ポーランド",
        "name_en": "Poland"
      },
      {
        "iso2": "ZA",
        "name_ja": "南アフリカ",
        "name_en": "South Africa"
      },
      {
        "iso2": "NZ",
        "name_ja": "ニュージーランド",
        "name_en": "New Zealand"
      },
      {
        "iso2": "CL",
        "name_ja": "チリ",
        "name_en": "Chile"
      },
      {
        "iso2": "KE",
        "name_ja": "ケニア",
        "name_en": "Kenya"
      },
      {
        "iso2": "EG",
        "name_ja": "エジプト",
        "name_en": "Egypt"
      },
      {
        "iso2": "IE",
        "name_ja": "アイルランド",
        "name_en": "Ireland"
      },
      {
        "iso2": "SE",
        "name_ja": "スウェーデン",
        "name_en": "Sweden"
      },
      {
        "iso2": "CZ",
        "name_ja": "チェコ",
        "name_en": "Czechia"
      }
    ],
    "year_coverage": {
      "from": 2023,
      "to": 2023
    },
    "metric_ids": [
      "japan.overseas_affiliates.count",
      "japan.overseas_affiliates.sales_jpy"
    ],
    "stats_data_ids": [
      "file=jp_affiliates_2024_detail.xlsx"
    ],
    "ingest_mode": "excel_file_semi_auto",
    "note_ja": "count（企業数）は本番値。sales_jpy（現地法人売上高・国別）は本表に非収録のため null（別表からの取込は今後検討）。"
  },
  "modules": {
    "C1_affiliates": {
      "module_id": "C1",
      "title_ja": "日系海外現地法人（国別）",
      "title_en": "Japanese overseas affiliates by country",
      "last_updated": "2026-10-18T22:02:56+09:00",
      "source": {
        "label": "METI 海外事業活動基本調査（第54回・2023年度実績）",
        "url": "https://www.meti.go.jp/statistics/tyo/kaigaizi/index.html"
      },
      "series": [
        {
          "iso2": "VN",
          "name_ja": "ベトナム",
          "observations": [
            {
              "year": 2023,
              "count": 1264.0,
              "sales_jpy": null,
              "unit_count": "companies",
              "metric_ids": [
                "japan.overseas_affiliates.count"
              ],
              "source_ref": "file=jp_affiliates_2024_detail.xlsx",
              "veritas": "✅"
            }
          ]
        },
        {
          "iso2": "TH",
          "name_ja": "タイ",
          "observations": [
            {
              "year": 2023,
              "count": 2305.0,
              "sales_jpy": null,
              "unit_count": "companies",
              "metric_ids": [
                "japan.overseas_affiliates.count"
              ],
              "source_ref": "file=jp_affiliates_2024_detail.xlsx",
              "veritas": "✅"
            }
          ]
        },
        {
          "iso2": "CN",
          "name_ja": "中国",
          "observations": [
            {
              "year": 2023,
              "count": 5673.0,
              "sales_jpy": null,
              "unit_count": "companies",
              "metric_ids": [
                "japan.overseas_affiliates.count"
              ],
              "source_ref": "file=jp_affiliates_2024_detail.xlsx",
              "veritas": "✅"
            }
          ]
        },
        {
          "iso2": "IN",
          "name_ja": "インド",
          "observations": [
            {
              "year": 2023,
              "count": 612.0,
              "sales_jpy": null,
              "unit_count": "companies",
              "metric_ids": [
                "japan.overseas_affiliates.count"
              ],
              "source_ref": "file=jp_affiliates_2024_detail.xlsx",
              "veritas": "✅"
            }
          ]
        },
        {
          "iso2": "ID",
          "name_ja": "インドネシア",
          "observations": [
            {
              "year": 2023,
              "count": 1098.0,
              "sales_jpy": null,
              "unit_count": "companies",
              "metric_ids": [
                "japan.overseas_affiliates.count"
              ],
              "source_ref": "file=jp_affiliates_2024_detail.xlsx",
              "veritas": "✅"
            }
          ]
        },
        {
          "iso2": "PH",
          "name_ja": "フィリピン",
          "observations": [
            {
              "year": 2023,
              "count": 590.0,
              "sales_jpy": null,
              "unit_count": "companies",
              "metric_ids": [
                "japan.overseas_affiliates.count"
              ],
              "source_ref": "file=jp_affiliates_2024_detail.xlsx",
              "veritas": "✅"
            }
          ]
        },
        {
          "iso2": "MY",
          "name_ja": "マレーシア",
          "observations": [
            {
              "year": 2023,
              "count": 765.0,
              "sales_jpy": null,
              "unit_count": "companies",
              "metric_ids": [
                "japan.overseas_affiliates.count"
              ],
              "source_ref": "file=jp_affiliates_2024_detail.xlsx",
              "veritas": "✅"
            }
          ]
        },
        {
          "iso2": "SG",
          "name_ja": "シンガポール",
          "observations": [
            {
              "year": 2023,
              "count": 1050.0,
              "sales_jpy": null,
              "unit_count": "companies",
              "metric_ids": [
                "japan.overseas_affiliates.count"
              ],
              "source_ref": "file=jp_affiliates_2024_detail.xlsx",
              "veritas": "✅"
            }
          ]
        },
        {
          "iso2": "KR",
          "name_ja": "韓国",
          "observations": [
            {
              "year": 2023,
              "count": 726.0,
              "sales_jpy": null,
              "unit_count": "companies",
              "metric_ids": [
                "japan.overseas_affiliates.count"
              ],
              "source_ref": "file=jp_affiliates_2024_detail.xlsx",
              "veritas": "✅"
            }
          ]
        },
        {
          "iso2": "HK",
          "name_ja": "香港",
          "observations": [
            {
              "year": 2023,
              "count": 1049.0,
              "sales_jpy": null,
              "unit_count": "companies",
              "metric_ids": [
                "japan.overseas_affiliates.count"
              ],
              "source_ref": "file=jp_affiliates_2024_detail.xlsx",
              "veritas": "✅"
            }
          ]
        },
        {
          "iso2": "AE",
          "name_ja": "UAE",
          "observations": [
            {
              "year": 2023,
              "count": 91.0,
              "sales_jpy": null,
              "unit_count": "companies",
              "metric_ids": [
                "japan.overseas_affiliates.count"
              ],
              "source_ref": "file=jp_affiliates_2024_detail.xlsx",
              "veritas": "✅"
            }
          ]
        },
        {
          "iso2": "SA",
          "name_ja": "サウジアラビア",
          "observations": [
            {
              "year": 2023,
              "count": 38.0,
              "sales_jpy": null,
              "unit_count": "companies",
              "metric_ids": [